titulo_original,tmdb_id,tipo,idioma,pais,nome_idioma,titulo_traduzido,sinopse_traduzida
2 Fast 2 Furious,584,movie,zh,TW,Mandarin,玩命關頭2：飆風再起,布萊恩歐康納是一個臥底警探，他走錯了一步路，因此必須付出慘痛代價。對他昔日的頂頭上司以及ＦＢＩ探員來說，上一次布萊恩不但壞了他們的事，搞砸了一場策劃多時的飛車搶劫調查案，他的臥底身份還被街頭飆車黨揭穿，他也把飛車搶案的主謀和飆車黨老大放走。雖然他這麼做證明自己很有義氣，但是卻也因此失去了警徽，讓自己在洛城混不下去。  現在，這是一個不同的城市，也是他翻身的最後一次機會。邁阿密的聯邦探員一直逮不到狡猾商人卡特魏隆的把柄，他們相信魏隆利用他的進出口貿易公司當掩護，進行國際洗錢的勾當、海關官員一年來都在嚴密監視魏隆的一舉一動，卻只發現他喜歡從事非法的街頭飆車活動。他們在走投無路之下，只好請布萊恩再度出馬，混入邁阿密的街頭飆車圈，希望能逮到這名國際洗錢組織的首腦。  布萊恩這個叛逆小子卻開出一個條件，他對警方和政府找來的合作夥伴非常不滿意，於是他堅持要和他的童年好友，前科犯羅曼皮爾斯攜手合作，因為他不但是一個犯罪高手，更是一個技術高超的飆車族。於是負責調查此案的聯邦探員馬克漢也向羅曼開出一個條件，只要他能和布萊恩一起破案，就把他前科累累的案底一筆勾消。這對前科犯和前任警探組成的飆車拍檔最後一次機會，就是把洗錢大亨魏隆逮捕歸案，但是當布萊恩愛上和魏隆關係曖昧不明的臥底女警探夢妮卡佛安蒂，他又陷入天人交戰的內心掙扎。速度與激情2，狂野極速，The Fast and the Furious 2，2 Fast 2 Furious
2 Fast 2 Furious,584,movie,es,MX,Spanish,"Más rápido, más furioso",El expolicía Brian O'Conner es llamado a atrapar a un peligroso criminal y recluta la ayuda de un examigo de la infancia y corredor callejero que tiene la oportunidad de redimirse.
2 Fast 2 Furious,584,movie,fa,IR,Persian,سریع و خشن ۲,پلیس سابق، «برایان او کانر»، به خاطر فراری دادن دوست متهمش، دستگیر می‌شود. اکنون به او فرصتی داده شده تا پلیس از مجازاتش چشم پوشی کند. او باید همراه یکی از دوستان قدیمی‌اش، به پلیس در دستگیری یک وارد کننده مواد مخدر کمک کند.
2 Fast 2 Furious,584,movie,lt,LT,Lithuanian,Greiti ir Įsiutę 2,"Policininkas Brajanas O’Koneris atleidžiamas iš tarnybos, tačiau jam suteikiama galimybė pasitaisyti. Kartu su buvusiu kaliniu jis turi nugabenti „nešvarių“ pinigų siuntą pogrindiniam Majamio verslininkui.  Tačiau iš tiesų herojus kartu su žaviąja agente dalyvauja slaptoje operacijoje, kurios tikslas - demaskuoti nusikaltėlius, besisukiojančius tarp nelegalių gatvės lenktynių organizatorių ir dalyvių. Lemtingos lenktynės netrukus įvyks po svilinančia Majamio saule. Tada ir paaiškės, kuris kiečiausias, kam lemta gyventi, o kam – mirti."
2 Fast 2 Furious,584,movie,vi,VN,Vietnamese,Quá Nhanh Quá Nguy Hiểm 2,"Brian O'Conner là một cảnh sát giỏi bị mất chức chỉ vì bọn tội phạm đã sử dụng những thủ đoạn quá tinh vi. Và nay anh có cơ hội chuộc lại lỗi lẫm với cuộc thử thách lần hai. Để thực hiện nhiệm vụ của mình, Brian O'Conner phải gia nhập hội đua xe trái phép trên các đường phố Miami để tìm kiếm tung tích Carter Verone, một tên tội phạm chuyên buôn ma tuý và rửa tiền. Anh và cậu bạn thân Roman Pearce được giao nhiệm vụ chuyển số tiền phi pháp cho Carter Verone hiện đang núp dưới danh nghĩa một thương gia xuất nhập khẩu ở Miami. Ngoài Roman Pearce, Brian O'Conner còn nhận được sự giúp đỡ của nữ mật vụ tài năng và hấp dẫn, Monica Clemente, trong vai người yêu bất đắc dĩ của Carter Verone. Và cuộc phiêu lưu cùng những pha rượt đuổi bắt đầu..."
2 Fast 2 Furious,584,movie,zh,HK,Mandarin,狂野時速 2,延續上集故事，警探拜仁的名譽已蒙上污點，不過上頭給他一次帶罪立功的機會。由於國際洗黑錢集團對街頭非法賽車非常熱衷，當局惟有請拜仁出馬，以他的賽車專長協助追查。拜仁與童年死黨兼惡名昭彰的釋囚羅民合作查案。調查期間，拜仁被臥底蒙妮迷倒。蒙妮嘉為了混入犯罪集團，不惜以身作餌來吸引集團主腦的主意。在罪惡滿佈的邁阿密街頭，臥底行動絕不容有半點差池…
2 Fast 2 Furious,584,movie,lv,LV,Latvian,Ātrs un bez žēlastības 2,"Turpinājums “Ātrajiem un negantajiem”. Brian O'Connor, apkaunots policists, bija ātruma ķēms un tagad par to maksā cenu. Kā to redz viņa bijušie priekšnieki un FBI galvenais misiņš, šis slepenais aģents uzskrēja vienu no vissvarīgākajām izmeklēšanām, ko viņi jebkad ir veikuši."
2 Fast 2 Furious,584,movie,uz,UZ,Uzbek,Forsaj 2,
2 Fast 2 Furious,584,movie,ca,ES,Catalan,,"Brian O'Connor, un policia caigut en desgràcia, va ser un addicte a la velocitat i ara n'està pagant un preu. Tal com ho veuen els seus antics caps i els alts comandaments de l'FBI, aquest agent d'incògnit els va fer malbé una de les investigacions més importants que havien emprès."
2 Fast 2 Furious,584,movie,ka,GE,Georgian,ფორსაჟი 2,
2 Fast 2 Furious,584,movie,hi,IN,Hindi,2 फ़ास्ट 2 फ़्युरियस,
