titulo_original,tmdb_id,tipo,idioma,pais,nome_idioma,titulo_traduzido,sinopse_traduzida
2 Fast 2 Furious,584,movie,en,US,English,,"It's a major double-cross when former police officer Brian O'Conner teams up with his ex-con buddy Roman Pearce to transport a shipment of ""dirty"" money for shady Miami-based import-export dealer Carter Verone. But the guys are actually working with undercover agent Monica Fuentes to bring Verone down."
2 Fast 2 Furious,584,movie,de,DE,German,,"Dem Cop Brian O'Conner werden nach einem Einsatz in der illegalen Rennszene wegen nicht ganz legaler Ermittlungsmethoden Führerschein und Dienstmarke entzogen. Nun erhält der auf Eis gelegte Gesetzeshüter eine Chance zur Bewährung: Gemeinsam mit der Undercover-Agentin Monica soll er Licht ins Dunkel diffuser Transaktionen eines verdächtigen Geschäftsmannes in Miami bringen. Wie es sich so fügt, ist jener auch ein begeisterter Anhänger destruktiver Sportwagenevents."
2 Fast 2 Furious,584,movie,it,IT,Italian,2 Fast 2 Furious,"Brian ha la velocità nel sangue. Passione talmente esagerata da avergli fruttato l’esonero dall’FBI e averlo costretto a riciclarsi come criminale al servizio del boss di Miami Carter Verone. Decadenza degli eroi? Solo apparentemente: in realtà Brian, coadiuvato dall’altra infiltrata Monica, agisce sotto copertura per sventare un traffico di denaro sporco, e se per ottenere i propri scopi c’è da impegnarsi in duelli automobilistici mozzafiato, ad altissima velocità e tasso di scorrettezza, poco male."
2 Fast 2 Furious,584,movie,fr,FR,French,2 Fast 2 Furious,"Brian O'Conner a signé sa plus belle action, mais aussi sa faute la plus grave, en laissant filer le chef du gang de voleurs de voitures qu'il avait mission d'infiltrer. Radié de la police de Los Angeles, ce jeune flic rebelle, fan de vitesse et de rodéos, a gardé intact son honneur mais a gâché une belle carrière. Après 2 ans de galère, Brian O'Conner se retrouve à Miami et se voit offrir une ultime chance de se racheter. Le FBI et les douanes locales surveillent depuis plusieurs mois le puissant homme d'affaires Carter Verone, qu'ils soupçonnent de se livrer à des opérations de blanchiment d'argent. Mais leurs efforts sont restés vains, le seul indice dont ils disposent pour appâter et démasquer l'énigmatique criminel étant sa passion pour les rodéos. Le temps presse, Brian semble être le seul espoir…"
2 Fast 2 Furious,584,movie,ru,RU,Russian,Двойной форсаж,"Несмотря на то, что после невероятных приключений в первом фильме герой картины, детектив Брайан О'Коннор (Уокер), был уволен со службы, - его страсть к гонкам и быстрым машинам не исчезла. А тут, как раз кстати, появляется заманчивое предложение снова поработать «под прикрытием» в Майами. Здесь О'Коннору, в обмен на его полицейский значок, предстоит тайно «внедриться» в окружение жестокого наркоторговца, чтобы вывести злодея «на чистую воду» и взять его с поличным!"
2 Fast 2 Furious,584,movie,tr,TR,Turkish,Daha Hızlı Daha Öfkeli,"Emekliye ayrılan Brian O’Connor, kendisini baştan çıkaran sokak yarışları ve yeraltı dünyasının kirli işlerine bulaşmadan duramaz. Eski dostu Roman Pearce ile birlikte takım kuran O’Connor, kirli para naklini gerçekleştirme operasyonu ile Miami’li tüccar Carter Verone’u yakalamanın peşindedir. Bu sırada el altından çalışan casus Monica Fuentes ile işbirliği yapar."
2 Fast 2 Furious,584,movie,es,ES,Spanish,2 Fast 2 Furious: A todo gas 2,"El agente del FBI Brian O'Conner cayó en desgracia al ver su lealtad puesta a prueba en su anterior trabajo en el mundo de las carreras ilegales de Los Angeles. La decisión de O’Conner le permitió conservar su honor, pero le hizo perder su insignia. Ahora ha pasado el tiempo, está en otra ciudad y tiene una última oportunidad. A los federales de Miami les está costando mucho detener a Carter Verone, un empresario que utiliza su negocio como tapadera para un cartel internacional de blanqueo de dinero. Aduanas sabe de su relación con las carreras callejeras ilegales, así que deciden llamar a O’Conner para vuelva a infiltrarse. Pero antes pone algunas condiciones para aceptar la misión. La primera: trabajar con su amigo de infancia y antiguo delincuente Roman Pearce, otro adicto a la velocidad."
2 Fast 2 Furious,584,movie,nl,NL,Dutch,2 Fast 2 Furious,"Brian O'Connor, een agent die in ongenade is gevallen, betaalt een zware prijs voor zijn snelheidsverslaving. Voor zover zijn bazen denken, heeft het heethoofd één van de grootste undercoveroperaties ooit verknald."
2 Fast 2 Furious,584,movie,fi,FI,Finnish,,"Turboahtimet hehkuvat tulipunaisen kuumina, kun Miamin kadut muuttuvat kuolemanvaaralliseksi kisaradaksi. Uskomattomia autoja, joista piiskataan raskaalla kaasujalalla kaikki irti, kauniita tyttöjä ja elämäntyyli, jonka puolesta voisi vaikka kuolla… Brian O'Conner on menettänyt työnsä annettuaan ystävänsä Dom Toretton, kaduilla kisaavan rikollispomon, paeta lain kovaa kouraa. Nyt hän on palannut Miamiin vanhan ystävänsä Roman Pearcen kanssa työskennelläkseen hengenvaarallisessa ""undercover""-operaatiossa. Brian auttaa upeaa Monica Fuentesia paljastamaan miamilaisen liikemiehen hämäräbisnekset. Kisakadun kutsu on kuitenkin voimakas ja tällä kertaa panoksena on elämä…"
2 Fast 2 Furious,584,movie,zh,CN,Mandarin,速度与激情2,迈阿密狡猾的商人卡特（科尔·豪瑟 Cole Hauser 饰）利用自己的贸易公司做幌子，暗中进行着国际洗钱活动。虽然 FBI 对他监视已久，但是卡特平日十分小心谨慎，几乎与世隔绝，所以一直没找到他的犯罪证据。FBI 获悉了卡特十分喜欢地下赛车，是当地飞车党的头目。为了获得他的犯罪证据，只好找上一集中成功破获洛杉矶飞车党劫车案的布莱恩（保罗·沃克 Paul Walker 饰）重新出山。布莱恩凭借出色的车技、和飞车党一起进行犯罪活动很快就赢得了卡特的信任。同时，另一名同为飞车党卧底的女警梦妮卡（伊娃·门德斯 Eva Mendes 饰）闯进了布莱恩的生活，布莱恩不知不觉中爱上了梦妮卡。梦妮卡已经获得了不少卡特的犯罪证据，但是她和卡特之间的暧昧关系却说不清道不明。
2 Fast 2 Furious,584,movie,pt,PT,Portuguese,Velocidade + Furiosa,"A cumprir uma pena de suspensão, o agente policial O'Conner tem agora uma oportunidade de se redimir, aceitando participar numa operação especial. Para tal, terá que se infiltrar no circuito das corridas de rua de forma a poder desmascarar um negócio que não é mais que uma forma dissimulada de branqueamento de dinheiros de um cartel."
2 Fast 2 Furious,584,movie,el,GR,Greek,Οι Μαχητές των Δρόμων 2,"Ο Μπράιαν Ο' Κόνορ έχει χάσει τη δουλειά του, όταν άφησε τον φίλο του, Ντομ Τορέτο, αφεντικό του εγκλήματος των αγώνων δρόμου να ξεφύγει από τον νόμο. Τώρα είναι πίσω στο Μαϊάμι με την παλιά του φίλη, Ρομάν. Εργάζεται ως μυστικός για τους μπάτσους για να γλιτώσει την τιμωρία για τις πράξεις του. Βοηθάει την εκπληκτική Μόνικα να εντοπίσει έναν κακόφημο επιχειρηματία του Μαϊάμι. Και ο Μπράιαν αγωνίζεται ξανά. Αυτή τη φορά, όμως, για τη ζωή του."
2 Fast 2 Furious,584,movie,pl,PL,Polish,"Za szybcy, za wściekli","Brian O’Conner stracił pracę po tym, jak pozwolił swemu koledze Domowi Toretto, szefowi mafii i jednocześnie uczestnikowi nielegalnych wyścigów, uciec wymiarowi sprawiedliwości. Brian wraca do Miami ze starym kumplem Romanem Pearcem. Pracuje jako tajny agent dla policji, aby uniknąć kary za popełnione czyny. Pomaga prześlicznej Monice Fuentes wytropić podejrzanego biznesmena z Miami. I znowu staje do wyścigów, tym razem – po swoje życie."
2 Fast 2 Furious,584,movie,hu,HU,Hungarian,Halálos iramban 2 - Halálosabb iram,"Az ex-zsaru Brian O'Conner sorra nyeri az illegális utcai autóversenyeket. Egyszer csak a volt kollégái látókörébe kerül, akik alkut ajánlanak neki: vagy kivonják a forgalomból, vagy segít elkapni Carter Veronét, a környék legnagyobb kábítószer-kereskedőjét. Érthető módon Brian ez utóbbi mellett dönt. Összeáll az egykori simlis, fekete haverjával, Roman Pearce-szel, hogy együtt vigyenek el egy rakomány ""mocskos"" pénzt a gyanús üzletembernek Miamiba. Kevesen tudják, hogy Brian valójában Monica Fuentes beépített ügynöknek segít Verone lebuktatásában."
2 Fast 2 Furious,584,movie,da,DK,Danish,,"Brian O'Connor er blevet suspenderet fra politiet, men han får nu chancen for at genvinde politiskiltet ved at påtage sig en ny farlig mission. Brian skal infiltrere lovløse motorbøller i Miami, hvor nye bander af hårdkogte bilentusiaster hærger med deres ekstremt hurtige, specialbyggede sportsvogne. Med hjælp fra en gammel ven, den tidligere straffefange Roman Pearce, og toldagenten Monica Clemente, forsøger Brian at skaffe håndfaste beviser mod den lyssky forretningsmand Carter Verone, som politiet mistænker for at være bagmanden i en magtfuld narkoliga. Efter at have vundet indpas i det illegale bilrace-miljø, bliver Brian og Roman snart hyret til at transportere en ladning narkopenge for Verone, og sagen ruller!"
2 Fast 2 Furious,584,movie,sv,SE,Swedish,,"Brian O'Conner har förlorat jobbet efter att ha låtit sin vän Dom Toretto, ledare för ett streetracing-gäng, komma undan rättvisan. Nu är han tillbaka i Miami igen med sin gamle vän Roman Pearce och tvingas jobba under täckmantel för polisen för att undvika straff för  sina handlingar. Han hjälper den vackra Monica Fuentes spåra en skum affärsman från Miami och kör street-racing igen – men den här gången får han köra för sitt liv…"
2 Fast 2 Furious,584,movie,sk,SK,Slovak,Rýchlo a zbesilo 2,"Voľné pokračovanie úspešného filmu, v ktorom hlavnú úlohu opäť zohrali rýchle autá a nelegálne pouličné preteky v špeciálne upravených automobiloch. Nasledujúci príbeh nás tentoraz zavedie do Miami. Policajt Brian O'Connor zlyhal pri vyšetrovaní svojho posledného prípadu. On sám sa síce cíti ako obeť, ale zároveň si je vedomý toho, že za svoj prehrešok musí tvrdo platiť. Preto bol nútený opustiť Los Angeles a nový prípad vníma ako svoju poslednú šancu. Hlavným podozrivým je tentoraz bohatý obchodník, ktorý si s najväčšou pravdepodobnosťou perie špinavé peniaze pre medzinárodný kartel. Všetko realizuje pod rúškom vývozových a dovozových aktivít. Viac ako rok je sledovaný colníkmi i políciou, jediným výsledkom je však poznanie, že Carter Verone má živé styky s organizátormi adrenalínových automobilových pretekov. Vyriešenie prípadu teraz stojí na Brianovi, ktorý už nemá čo stratiť."
2 Fast 2 Furious,584,movie,cs,CZ,Czech,Rychle a zběsile 2,"Volné pokračování úspěšného filmu, v němž hlavní roli hrála supersilná auta a nelegální uliční závody ve speciálně upravených vozech, nás tentokrát zavede do Miami. Někdejší policista Brian O'Connor při vyšetřování svého posledního případu selhal. On sám se sice cítí jako oběť, ale zároveň si je vědom, že za svůj prohřešek musí platit. Proto opustil Los Angeles a nový případ chápe jako svoji poslední šanci. Hlavním podezřelým je tentokrát bohatý obchodník, který s největší pravděpodobností, pod rouškou vývozních a dovozních aktivit, pere špinavé peníze pro jakýsi mezinárodní kartel. Víc než rok už je sledován celníky i policií, ale jediným výsledkem je poznání, že Carter Verone má živé styky s organizátory adrenalinových automobilových závodů. Vše je tedy na Brianovi, který už nemá co ztratit."
2 Fast 2 Furious,584,movie,no,NO,Norwegian,,"Brian O'Connor mistet politijobben på grunn av fartslekene sine. Mens han infiltrerte det lysskye bilmiljøet i Los Angele røpet seg han som spaner og lot lederen av en gjeng kriminelle slippe unna. O'Connor får en ny sjanse. FBI i Miami sliter med å huke inn Carter Verone, en forretningsmann som bruker import- og eksportfirmaet sitt som skalkeskjul for storstilt hvitvasking av penger."
2 Fast 2 Furious,584,movie,he,IL,Hebrew,מהיר ועצבני 2,"סרט המשך קיצי ללהיט הקופתי עתיר האקשן והמכוניות משנת 2001. השוטר לשעבר בריאן אוקונור שב וחובר לחברו משכבר, האסיר לשעבר רומן פירס לביצוע משלוח של כסף מלוכלך עבור הפושע קארטר ורון. בו בזמן עובדים השניים עם סוכנת חשאית המנסה להפיל את ורון - כאשר הכל מתרחש על רקע עולם מירוצי המכוניות של מיאמי."
2 Fast 2 Furious,584,movie,th,TH,Thai,เร็ว...แรงทะลุนรก เร็วคูณ 2 ดับเบิ้ลแรงท้านรก,มันง่ายที่จะไปถึง และมันเข้าใกล้กับวงล้อ ที่วิ่งด้วยความเร็วสูง... ไบรอัน โอคอนเนอร์ (พอล วอลเกอร์) ซึ่งตอนนี้กลายเป็นตำรวจที่ถูกถอดยศ กลับกลายเป็นเหยื่อของมัน... และตอนนี้ เขากำลังจะต้องชดใช้ ขณะที่บรรดาอดีตเจ้านาย และพวกเอฟบีไอต่างเป็นกังวล ตำรวจลับหนุ่มเลือดร้อนผู้นี้ กำลังทำการสืบสวนคดีที่ใหญ่ที่สุดเท่าที่เคยมีมา ความสัตย์ซื่อของเขาต้องผ่านการทดสอบ ในขณะที่เขาแฝงตัวเข้าไปในโลกความเร็ว ที่ทะยานไปท่ามกลางความมืดแห่งราตรี ของวงการซิ่งรถบนถนนหลวง
2 Fast 2 Furious,584,movie,sr,RS,Serbian,Пребрзи и прежестоки,"Бивши полицијски детектив Брајан О' Конор напустио је Лос Анђелес због ометања истраге због чега је постао одметник од закона. Одселио се у Мајами где зарађује учествовајући у уличним тркама које организује његов пријатељ Теј. Ухапшен је у сарадњи полиције и порезне агентикиње Монике Фуентес, те му је понуђена амнестија уколико прихвати тајни задатак инфилтрирања у редове нарко-боса Картера Веронеа који користи илегалне аутомобилске трке за прање новца. Брајан прихвата задатак под условом да му допусте да за партнера узме свог некадашњег пријатеља Романа Пирса."
2 Fast 2 Furious,584,movie,et,EE,Estonian,Kiired ja vihased 2,"Detektiiv Brian O’Conner (Paul Walker) on politseist varem toimunu eest vallandatud ja teenib nüüd elatist illegaalsete võidusõitudega. Kuid lõpuks jääb ta vahele. Talle antakse valiku võimalus: kas minna vangi või töötada Miamis salaagendina, et sealne narkoärikas Carter Verone’i (Cole Hauser) koos asitõenditega vahele võtta. Talle on abiks juba siseringi imbunud agent Monica Clemente (Eva Mendes) ja tema just vanglast vabanenud sõber Roman Pearce (Tyrese Gibson)."
2 Fast 2 Furious,584,movie,ko,KR,Korean,패스트 & 퓨리어스 2,"도미니크와의 의리는 지켰지만 경찰로서 자신이 쌓아 왔던 모든 것을 잃은 브라이언은 경찰 뱃지를 반납하고 LA 를 떠나 스트리트 레이서로서 내깃돈을 따며 전국을 떠돌고 있다. 마이애미 연방정부는 돈 세탁을 무역사업으로 둔갑시켜 화려한 사업가 행세를 하고 있는 카터 베론을 검거하려 하지만, 그가 불법 스트리트 레이싱에 관련되었단 사실 이외에는 별 다른 수확을 거두지 못하고 있었다. 이에 마이애미 연방정부는 스트리트 레이서로 그 실력을 인정 받은 브라이언과 전과자인 로만 피어스에게 그를 검거할 수 있는 증거를 찾아 줄 것을 요구하는데..."
2 Fast 2 Furious,584,movie,bg,BG,Bulgarian,Бързи и яростни 2,"Брайън О'Конър е преследван от полицията, поради проблеми със закона и е принуден да напусне Лос Анджелис и да се премести в Маями.За да закърпи финансовото си състояние той кръстосва улиците на града с цел да участва в улични състезания.В крайна сметка обаче криминалните действия на Брайън са разкрити от полицията.За да избегне повторен престой в затвора и за да изчисти криминалното си досие, Брайън трябва да залови местния наркобос лорд Картър Вероне.На Брайън му е предоставена възможността да избере партньора си.в крайна сметка той решава да се върне в Калифорния и призовава своя стар приятел Роман Пиърс да му помогне в осъществяване на плана му.Пиърс приема предложението като в замяна изисква от полицията да изчисти криминалното му досие.С помощта на Моника, Брайън и Роман работят съвместно за да дискредитират Вероне."
2 Fast 2 Furious,584,movie,ja,JP,Japanese,ワイルド・スピードX2,元警察官のブライアンは各地を逃亡しつつ流れ着いた先のマイアミで、ストリートレーサーとしてカリスマ的存在になっていたが、ある夜のレース後に、警官隊によって連行されてしまう。連行先のロサンゼルスでの強盗団捜査の指揮を執るFBI捜査官・ビルキンスの指示によるものであった。 過去の免罪の見返りとして麻薬組織の囮捜査を強要されたブライアンは、旧友のローマン・ピアースをパートナーとして捜査に乗り出すのだった。
2 Fast 2 Furious,584,movie,ro,RO,Romanian,"Mai furios, mai iute","Brian O’Connor, un polițist căzut în dizgrație, a ajuns o victimă a vitezei... și acum plătește prețul.  Foștii săi superiori sunt de părere că O’Connorr le-a compromis una din cele mai mari investigații făcute vreodată. Loialitatea sa față de poliție a fost testată atunci când O’Connor s-a infiltrat în lumea curselor ilegale din Los Angeles. El și-a dezvăluit în cele din urmă adevărata ocupație și l-a lăsat pe organizatorul unei lovituri de proporții să scape, mai precis să fugă cu un bolid de curse. Decizia lui O’Connor i-a permis să-și păstreze onoarea dar și-a pierdut insigna și orice șansă de reabilitare."
2 Fast 2 Furious,584,movie,id,ID,Indonesian,,
2 Fast 2 Furious,584,movie,hr,HR,Croatian,Prebrzi i prežestoki,"Kad ga prijatelj Tej (C. ""Ludacris"" Bridges), mehaničar skupocjenih i izuzetno brzih automobila, obavijesti da se na gradskim ulicama održava još jedna noćna utrka, Brian O´Conner (P. Walker) bez razmišljanja pristane sudjelovati. On je bivši detektiv iz Los Angelesa i ljubitelj brze vožnje koji je izbačen iz službe te se preselio u Miami gdje živi od sudjelovanja u ilegalnim automobilskim utrkama. Kad lako pobijedi i u ovoj utrci, u kojoj snage odmjeri i s atraktivnom Suki (D. Aoki) i energičnim Orange Juliusom (A. Nolasco), Brian među okupljenim gledateljima uoči privlačnu Hispanoamerikanku (E. Mendes). Kad ga policijski agenti Markham (J. Remar) i Bilkins (T. Barry) privedu na razgovor, Brian dozna da je djevojka koju je primijetio agentica Monica Fuentes, koja se uspjela ubaciti u zločinačku organizaciju Cartera Veronea (C. Hauser). Verone je narko-diler koji ilegalne automobilske utrke koristi za pranje novca, a Monica je uspjela postati njegova osoba od povjerenja."
2 Fast 2 Furious,584,movie,pt,BR,Portuguese,+ Velozes + Furiosos,"O ex-policial Brian comete uma grande traição, juntando-se a um amigo ex-presidiário no transporte de dinheiro sujo para uma importadora-exportadora muito suspeita."
2 Fast 2 Furious,584,movie,ar,SA,Arabic,2 سريع 2 غاضب,"إنه تقاطع مزدوج كبير عندما يتعاون ضابط الشرطة السابق بريان أوكونر مع صديقه السابق رومان بيرس لنقل شحنة من الأموال ""القذرة"" لتاجر الاستيراد والتصدير المشبوه في ميامي كارتر فيرون.  لكن الرجال يعملون بالفعل مع العميلة السرية مونيكا فوينتيس لإسقاط فيرون."
2 Fast 2 Furious,584,movie,fr,CA,French,Rapides et dangereux 2,"Brian O'Conner a signé sa plus belle action, mais aussi sa faute la plus grave, en laissant filer le chef du gang de voleurs de voitures qu'il avait mission d'infiltrer. Radié de la police de Los Angeles, ce jeune flic rebelle, fan de vitesse et de rodéos, a gardé intact son honneur mais a gâché une belle carrière. Après deux ans de galère, Brian O'Conner se retrouve à Miami et se voit offrir une ultime chance de se racheter.Le FBI et les douanes locales surveillent depuis plusieurs mois le puissant homme d'affaires Carter Verone, qu'ils soupçonnent de se livrer à des opérations de blanchiment d'argent. Mais leurs efforts sont restés vains, le seul indice dont ils disposent pour appâter et démasquer l'énigmatique criminel étant sa passion pour les rodéos. Le temps presse, Brian semble être le seul espoir..."
2 Fast 2 Furious,584,movie,sl,SI,Slovenian,Prehitri in predrzni,"Podjetnik Carter Verone svoje podjetje uporablja za ponarejanje denarja in tihotapljenje mamil. Agenti FBI ga opazujejo že več kot leto dni, vendar mu ne morejo dokazati ničesar, razen nezakonitih cestnih dirk. Na robu obupa se obrnejo na bivšega policista Briana O'Connorja in bivšega zapornika Romana Pearca. Ponudijo jima dogovor, ki ga ne moreta zavrniti. Tako pod krinko cestnih dirkačev začneta delati za Verona. Poleg privlačnih avtomobilov in nevarne naloge ju zdaj čaka adrenalinska vožnja, polna preobratov in presenečenj."
2 Fast 2 Furious,584,movie,uk,UA,Ukrainian,Подвійний форсаж,"Колишній поліцейський Браян О'Коннер разом з напарником Романом Пірсом збираються перевезти велику суму «брудних» грошей відомого мафіозі Картера Верона в якості його підручних. Але насправді ця робота є тільки прикриттям для Браяна, який разом з таємним агентом Монікою Клемент повинні викрити спритного злочинця..."
